<?xml version="1.0" encoding="UTF-8"?>
<instances
	xmlns="http://www.weblab.deusto.es/configuration" 
	xmlns:xsi="http://www.w3.org/2001/XMLSchema-instance"
	xsi:schemaLocation="machine_configuration.xsd"
>
    <runner file="launch_sample_balanced2_concurrent_experiments_machine.py"/>
	<configuration file="machine_config.py" />

	<instance>main_instance1</instance>
	<instance>main_instance2</instance>
	<instance>main_instance3</instance>
	<instance>lab_and_experiment1</instance>
	<instance>lab_and_experiment2</instance>
</instances>

